{"schema_version":1,"campaign_id":"seaside-2027","last_read_at":"2026-11-10T09:17:03Z","points":[{"date":"2026-10-12","raised_pence":0,"target_pence":200000,"supporters":0},{"date":"2026-10-13","raised_pence":15000,"target_pence":200000,"supporters":6},{"date":"2026-10-14","raised_pence":31000,"target_pence":200000,"supporters":11},{"date":"2026-10-20","raised_pence":61000,"target_pence":200000,"supporters":19},{"date":"2026-10-21","raised_pence":90000,"target_pence":200000,"supporters":26},{"date":"2026-10-22","raised_pence":87000,"target_pence":200000,"supporters":25},{"date":"2026-11-03","raised_pence":105000,"target_pence":200000,"supporters":31},{"date":"2026-11-10","raised_pence":125000,"target_pence":200000,"supporters":37}]}
